,Text,Clean_Text,Media,Label
0,"Cryptocurrency enthusiasts have eagerly anticipated the third week of April, counting down the days until a potentially crucial moment in Bitcoin’s development called “the halving.”

Essentially, the halving is a scheduled reduction in the number of new Bitcoin that go into circulation. As the supply falls, some analysts anticipate that the digital currency’s price will soar.

These reductions happen every four years or so. But this year’s halving has drawn especially enthusiastic attention as the crypto industry rebounds from years of falling prices and corporate implosions.

In recent months, Bitcoin’s price has surged to record highs, reaching $73,000 in March. Much of that increase was driven by the approval of new financial products tied to Bitcoin, which spurred billions of dollars in new investment. Crypto investors are hoping that the halving will create a similar effect, causing Bitcoin’s price to climb further.",cryptocurrency enthusiasts have eagerly anticipated the third week of april counting down the days until a potentially crucial moment in bitcoin s development called the halving essentially the halving is a scheduled reduction in the number of new bitcoin that go into circulation as the supply falls some analysts anticipate that the digital currency s price will soar these reductions happen every four years or so but this year s halving has drawn especially enthusiastic attention as the crypto industry rebounds from years of falling prices and corporate implosions in recent months bitcoin s price has surged to record highs reaching in march much of that increase was driven by the approval of new financial products tied to bitcoin which spurred billions of dollars in new investment crypto investors are hoping that the halving will create a similar effect causing bitcoin s price to climb further ,The New York Times,Technology
1,"Being an influencer can be a lot of work. Instagram thinks A.I. can lend a big hand.

Instagram is pitching popular influencers on a program that relies on artificial intelligence to interact with fans, the latest example of how Meta, Instagram’s parent company, is trying to expand the technology across its products.

The program, which is in its early stages of testing and known as “Creator A.I.,” would allow influencers to chat with fans through direct messages on the social network and potentially through Instagram comments in the future, according to five people briefed on the company’s plans. The program will essentially be a chatbot that mimics the “voice” of the Instagram influencer to respond to fans, the people said.

Most of the messages would be sent automatically and would at least initially disclose that they were A.I.-generated, according to two of the people.

The goal, according to the people, is to give creators with large followings the ability to better connect with fans while decreasing the amount of work required to personally respond to large numbers of messages and comments. The people spoke on condition of anonymity because they were asked to sign nondisclosure agreements as part of the program.",being an influencer can be a lot of work instagram thinks a i can lend a big hand instagram is pitching popular influencers on a program that relies on artificial intelligence to interact with fans the latest example of how meta instagram s parent company is trying to expand the technology across its products the program which is in its early stages of testing and known as creator a i would allow influencers to chat with fans through direct messages on the social network and potentially through instagram comments in the future according to five people briefed on the company s plans the program will essentially be a chatbot that mimics the voice of the instagram influencer to respond to fans the people said most of the messages would be sent automatically and would at least initially disclose that they were a i generated according to two of the people the goal according to the people is to give creators with large followings the ability to better connect with fans while decreasing the amount of work required to personally respond to large numbers of messages and comments the people spoke on condition of anonymity because they were asked to sign nondisclosure agreements as part of the program ,The New York Times,Technology
2,"The Rome boutique Chez Dede, founded in 2011 by the design duo Daria Reina and Andrea Ferolla, is filled with antiques and artworks, as well as silk-screened tote bags and limited-edition collaborations: wicker lamps created with Atelier Vime and enameled brass jewelry inspired by playing cards with the Italian jewelry designer Allegra Riva. When the penthouse apartment in the same building as the store came up for rent in 2019, the couple and their team decided to create a suite that would further bring visitors into their world. After they got city permits in early 2023, it took them about a year to renovate the two-bedroom, two-bathroom apartment, now named Superattico Monserrato. They put in sliding doors, updated the kitchen with steel counters and glossy black walls and added dozens of theatrical Chez Dede touches: 17th-century carved wooden columns, a wall-size 18th-century tapestry, drawings by the 93-year-old Rome-based artist Isabella Ducrot and bed linens from their own collection. Early this year, Reina and Ferolla began renting the flat to a select few. “It’s really about sharing our lifestyle and our taste,” Reina says — and about imparting their tips for Rome: The Chez Dede team has a space at the front of the apartment, so at any point guests can stick their heads in and ask for favorite vintage shops and cafes. Superattico Monserrato also hosts occasional events: Up next is a trunk show with the designer Sara Beltran of jewelry brand Dezso, on May 9. Email superattico@chezdede.com to book; about $1,900 a night, minimum three nights.",the rome boutique chez dede founded in by the design duo daria reina and andrea ferolla is filled with antiques and artworks as well as silk screened tote bags and limited edition collaborations wicker lamps created with atelier vime and enameled brass jewelry inspired by playing cards with the italian jewelry designer allegra riva when the penthouse apartment in the same building as the store came up for rent in the couple and their team decided to create a suite that would further bring visitors into their world after they got city permits in early it took them about a year to renovate the two bedroom two bathroom apartment now named superattico monserrato they put in sliding doors updated the kitchen with steel counters and glossy black walls and added dozens of theatrical chez dede touches th century carved wooden columns a wall size th century tapestry drawings by the year old rome based artist isabella ducrot and bed linens from their own collection early this year reina and ferolla began renting the flat to a select few it s really about sharing our lifestyle and our taste reina says and about imparting their tips for rome the chez dede team has a space at the front of the apartment so at any point guests can stick their heads in and ask for favorite vintage shops and cafes superattico monserrato also hosts occasional events up next is a trunk show with the designer sara beltran of jewelry brand dezso on may email superattico chezdede com to book about a night minimum three nights ,The New York Times,Travel
3,"Japan’s public transportation is known for its punctuality, efficiency and high-quality service, which means train travel is a great way to see the countryside and to experience Japanese culture — even if you’re squeezed into Tokyo’s crowded Yamanote line at rush hour or experiencing the popular high-speed Shinkansen bullet train.

But many savvy visitors crisscross the country in another way, using luxury trains that resemble five-star hotels on rails.

Luxury rail travel appeals to “someone who wants slow travel, the experience of excellent service in a contained environment, the finest dining, the most exquisite accommodation with private bathrooms,” Simon Pielow, co-founder of the Luxury Train Club, said by phone from Wiltshire County, England. “Things that many people have no idea is possible on anything other than a royal train.”

One trip chartered by his agency starts and ends at Hakata station in the city of Fukuoka, crossing the southern Japanese island of Kyushu on the Seven Stars, a seven-car luxury sleeper train. Journeys for either two days and one night (per person, double occupancy) range from 650,000 to 900,000 yen (about $4,292 to $5,942), or four days and three nights from ¥1.2 million to ¥1.6 million. (A single supplement would apply.)",japan s public transportation is known for its punctuality efficiency and high quality service which means train travel is a great way to see the countryside and to experience japanese culture even if you re squeezed into tokyo s crowded yamanote line at rush hour or experiencing the popular high speed shinkansen bullet train but many savvy visitors crisscross the country in another way using luxury trains that resemble five star hotels on rails luxury rail travel appeals to someone who wants slow travel the experience of excellent service in a contained environment the finest dining the most exquisite accommodation with private bathrooms simon pielow co founder of the luxury train club said by phone from wiltshire county england things that many people have no idea is possible on anything other than a royal train one trip chartered by his agency starts and ends at hakata station in the city of fukuoka crossing the southern japanese island of kyushu on the seven stars a seven car luxury sleeper train journeys for either two days and one night per person double occupancy range from to yen about to or four days and three nights from million to million a single supplement would apply ,The New York Times,Travel
4,"I stepped off the platform at the gleaming new Maxcanú train station, eager to see the magnificent Maya archaeological site of Uxmal. All I needed was a taxi to take me there, a trip of about 30 miles away.

There are no taxis, said the stationmaster, as we stood on the polished limestone floors of the high-ceilinged station, which was cool and breezy despite the brilliant late-morning sun outside. And I was the third person in two weeks to get off at Maxcanú expecting to reach Uxmal, he said.

I was midway through a five-day trip to explore the brand-new Maya Train and several of its destinations in the Yucatán Peninsula of Mexico. Designed to run 965 miles (1,554 kilometers) around a loop of 34 stations when completed, the train will whisk passengers in cool comfort through colonial cities, archaeological sites, splashy resorts and tropical forests.

Now I was stunned. Wrangling a taxi has never been a problem in Mexico. But the drivers gathered in the main square of Maxcanú offered only beat-up vans that hopscotch through small towns, where I might or might not find a taxi to Uxmal. The next van was leaving in 45 minutes.",i stepped off the platform at the gleaming new maxcanú train station eager to see the magnificent maya archaeological site of uxmal all i needed was a taxi to take me there a trip of about miles away there are no taxis said the stationmaster as we stood on the polished limestone floors of the high ceilinged station which was cool and breezy despite the brilliant late morning sun outside and i was the third person in two weeks to get off at maxcanú expecting to reach uxmal he said i was midway through a five day trip to explore the brand new maya train and several of its destinations in the yucatán peninsula of mexico designed to run miles kilometers around a loop of stations when completed the train will whisk passengers in cool comfort through colonial cities archaeological sites splashy resorts and tropical forests now i was stunned wrangling a taxi has never been a problem in mexico but the drivers gathered in the main square of maxcanú offered only beat up vans that hopscotch through small towns where i might or might not find a taxi to uxmal the next van was leaving in minutes ,The New York Times,Travel
5,"Amy Snook knows more about wine than your average traveler. Originally from California, she now lives in the Douro Valley of Portugal, her partner works in the wine industry, and she has visited 47 countries, many of which have celebrated viticulture. But seven years ago, on a trip to Mendoza, a winemaking region in the foothills of Argentina’s Andes Mountains, she opted to abstain from drinking alcohol, a decision she would repeat in future travels.

“It’s such a long flight to Argentina, and I was only there for 10 days,” said Ms. Snook, 34, a publishing professional. “I’m aware of how alcohol affects me, and I chose to prioritize feeling amazing every day of the trip over dealing with a hangover.”

During her visit, Ms. Snook bicycled between vineyards, reveled in breathtaking scenery, relaxed with spa treatments and engaged with sommeliers and winemakers, coming away with a new appreciation for sustainable and regenerative agriculture.

“The obvious question when you tell someone that you aren’t drinking is, ‘Out of all the places you could go, why travel to wine country?’” she said. “But to me, it makes perfect sense because these regions offer all the perks of luxury travel — wellness amenities, beautiful landscapes and fine dining.”",amy snook knows more about wine than your average traveler originally from california she now lives in the douro valley of portugal her partner works in the wine industry and she has visited countries many of which have celebrated viticulture but seven years ago on a trip to mendoza a winemaking region in the foothills of argentina s andes mountains she opted to abstain from drinking alcohol a decision she would repeat in future travels it s such a long flight to argentina and i was only there for days said ms snook a publishing professional i m aware of how alcohol affects me and i chose to prioritize feeling amazing every day of the trip over dealing with a hangover during her visit ms snook bicycled between vineyards reveled in breathtaking scenery relaxed with spa treatments and engaged with sommeliers and winemakers coming away with a new appreciation for sustainable and regenerative agriculture the obvious question when you tell someone that you aren t drinking is out of all the places you could go why travel to wine country she said but to me it makes perfect sense because these regions offer all the perks of luxury travel wellness amenities beautiful landscapes and fine dining ,The New York Times,Travel
6,"This past October, I found myself in Yoshida Village standing before a tatara, a giant open-top furnace that was filled with charcoal and raging with such controlled ferocity that it could have been a set piece in Lucifer’s bedroom.

Deep within the belly of those orange flames sat a growing and mangled ingot that contained some exceptionally high-quality steel called tamahagane, or jewel steel, from which Japanese swords have been made for much of the country’s history. The presence of a usable ingot seemed unlikely, and if true, downright alchemic. All we had been doing for the last 20 hours was gently shaking iron sand and fresh charcoal onto the flames at timed intervals.

Yoshida is nestled back in the mountains of Shimane Prefecture in central Japan, abutting the ever-turbulent Sea of Japan. For nearly 700 years, workers around Yoshida made jewel steel in places called tatara-ba (literally “furnace spots”) on a grueling schedule — one that reshaped mountains and rivers, that seared the brows of generations of sooty men shoveling charcoal in loincloths. Then, at the start of the 20th century, production all but ceased. Other methods were cheaper and more efficient.",this past october i found myself in yoshida village standing before a tatara a giant open top furnace that was filled with charcoal and raging with such controlled ferocity that it could have been a set piece in lucifer s bedroom deep within the belly of those orange flames sat a growing and mangled ingot that contained some exceptionally high quality steel called tamahagane or jewel steel from which japanese swords have been made for much of the country s history the presence of a usable ingot seemed unlikely and if true downright alchemic all we had been doing for the last hours was gently shaking iron sand and fresh charcoal onto the flames at timed intervals yoshida is nestled back in the mountains of shimane prefecture in central japan abutting the ever turbulent sea of japan for nearly years workers around yoshida made jewel steel in places called tatara ba literally furnace spots on a grueling schedule one that reshaped mountains and rivers that seared the brows of generations of sooty men shoveling charcoal in loincloths then at the start of the th century production all but ceased other methods were cheaper and more efficient ,The New York Times,Travel
7,"The Blue Lagoon resort in the south of Iceland is a scenic network of steaming azure pools surrounded by dark rocks, where tourists dip in the geothermal water, have spa treatments and enjoy what the resort advertises as “a universe of radiant well-being.”

But last week, a stream of radiant lava burst from a crater a few miles from the resort, forcing it to evacuate hundreds of guests, in yet another eruption of a volcano system in the Reykjanes Peninsula that had been dormant for 800 years.

The outbursts began in 2021, and the eruptions and earthquakes in the peninsula have destroyed some houses and forced villagers from their homes. One construction worker went missing in the town of Grindavik after falling down a crack caused by an earthquake.

The effects of the volcanic eruptions have rippled out beyond the peninsula, disrupting the tourism operations of a country that relies heavily on visitors.",the blue lagoon resort in the south of iceland is a scenic network of steaming azure pools surrounded by dark rocks where tourists dip in the geothermal water have spa treatments and enjoy what the resort advertises as a universe of radiant well being but last week a stream of radiant lava burst from a crater a few miles from the resort forcing it to evacuate hundreds of guests in yet another eruption of a volcano system in the reykjanes peninsula that had been dormant for years the outbursts began in and the eruptions and earthquakes in the peninsula have destroyed some houses and forced villagers from their homes one construction worker went missing in the town of grindavik after falling down a crack caused by an earthquake the effects of the volcanic eruptions have rippled out beyond the peninsula disrupting the tourism operations of a country that relies heavily on visitors ,The New York Times,Travel
8,"Dorothy Dean, the writer, socialite and Warhol Factory regular, was a central figure of bohemian New York in the ’60s and ’70s. But despite her circle of famed confidants, she died in relative obscurity in Boulder, Colo., in 1987. Nearly a decade later, the writer Hilton Als recounted Dean’s life story for The New Yorker: She was the first Black high school valedictorian at White Plains High School in New York, a graduate of both Radcliffe College and Harvard, the first female fact checker at The New Yorker, part of a clique of white gay men she called “the Lavender Brotherhood” and a tough-as-nails bouncer at the nightclub Max’s Kansas City. Now, a new book compiles a selection of Dean’s unpublished writing and letters along with her newsletter of biting film reviews called the “All-Lavender Cinema Courier.” Titled “Who Are You Dorothy Dean?,” the book is edited by the Paris-based filmmaker Anaïs Ngbanzo and published by the press she founded in 2020, Éditions 1989, which focuses on biographical books and artists’ writings. On March 19 at the Institute of Contemporary Arts in London, Ngbanzo will also bring Dean’s acerbic humor to the stage with “Dorothy,” a play adapted from her correspondences with the artist Rene Ricard, the model Edie Sedgwick and the music journalist Lisa Robinson. “Who Are You Dorothy Dean?,” about $23, editions1989.com.",dorothy dean the writer socialite and warhol factory regular was a central figure of bohemian new york in the s and s but despite her circle of famed confidants she died in relative obscurity in boulder colo in nearly a decade later the writer hilton als recounted dean s life story for the new yorker she was the first black high school valedictorian at white plains high school in new york a graduate of both radcliffe college and harvard the first female fact checker at the new yorker part of a clique of white gay men she called the lavender brotherhood and a tough as nails bouncer at the nightclub max s kansas city now a new book compiles a selection of dean s unpublished writing and letters along with her newsletter of biting film reviews called the all lavender cinema courier titled who are you dorothy dean the book is edited by the paris based filmmaker anaïs ngbanzo and published by the press she founded in éditions which focuses on biographical books and artists writings on march at the institute of contemporary arts in london ngbanzo will also bring dean s acerbic humor to the stage with dorothy a play adapted from her correspondences with the artist rene ricard the model edie sedgwick and the music journalist lisa robinson who are you dorothy dean about editions com ,The New York Times,Travel
9,"Determining whether someone has Alzheimer’s disease usually requires an extended diagnostic process. A doctor takes a patient’s medical history, discusses symptoms, administers verbal and visual cognitive tests.

The patient may undergo a PET scan, an M.R.I. or a spinal tap — tests that detect the presence of two proteins in the brain, amyloid plaques and tau tangles, both associated with Alzheimer’s.

All of that could change dramatically if new criteria proposed by an Alzheimer’s Association working group are widely adopted.

Its final recommendations, expected later this year, will accelerate a shift that is already underway: from defining the disease by symptoms and behavior to defining it purely biologically — with biomarkers, substances in the body that indicate disease.",determining whether someone has alzheimer s disease usually requires an extended diagnostic process a doctor takes a patient s medical history discusses symptoms administers verbal and visual cognitive tests the patient may undergo a pet scan an m r i or a spinal tap tests that detect the presence of two proteins in the brain amyloid plaques and tau tangles both associated with alzheimer s all of that could change dramatically if new criteria proposed by an alzheimer s association working group are widely adopted its final recommendations expected later this year will accelerate a shift that is already underway from defining the disease by symptoms and behavior to defining it purely biologically with biomarkers substances in the body that indicate disease ,The New York Times,Health
10,"The outbreak of dengue fever that has unfolded in Latin America over the past three months is staggering in its scale — a million cases in Brazil in a matter of weeks, a huge spike in Argentina, a state of emergency declared in Peru and now another in Puerto Rico.

It forewarns of a changing landscape for the disease. The mosquitoes that spread dengue thrive in densely populated cities with weak infrastructure, and in warmer and wetter environments — the type of habitat that is expanding quickly with climate change.

More than 3.5 million cases of dengue have been confirmed by governments in Latin America in the first three months of 2024, compared with 4.5 million in all of 2023. There have been more than 1,000 deaths so far this year. The Pan-American Health Organization is warning that this may be the worst year for dengue ever recorded.",the outbreak of dengue fever that has unfolded in latin america over the past three months is staggering in its scale a million cases in brazil in a matter of weeks a huge spike in argentina a state of emergency declared in peru and now another in puerto rico it forewarns of a changing landscape for the disease the mosquitoes that spread dengue thrive in densely populated cities with weak infrastructure and in warmer and wetter environments the type of habitat that is expanding quickly with climate change more than million cases of dengue have been confirmed by governments in latin america in the first three months of compared with million in all of there have been more than deaths so far this year the pan american health organization is warning that this may be the worst year for dengue ever recorded ,The New York Times,Health
