,Text,Clean_Text,Media,Label
85," — Collin Morikawa had another solid round Friday in the RBC Heritage with a 5-under 66 and appears to be getting back to the reliable form that made him a two-time major champion. Masters champion Scottie Scheffler’s form never seems to change. Even after an emotionally taxing victory at Augusta National, a quick trip home to Dallas and only nine holes of practice, the world’s No. 1 player is right in the mix.

It’s crowded at the top after two days of warm, ideal conditions for scoring at Harbour Town, and this $20 million signature event is wide open going into the weekend.

Morikawa had a four-way share of the lead with Tom Hoge (64), J.T. Poston (68) and Sepp Straka, who recovered from an opening drive that plunked a spectator in the head and led to a double bogey. Straka saw blood but settled down after hearing the spectator was going to be fine, then put together eight birdies for a 65.



They were at 11-under 131, one shot ahead of a group that features Ludvig Aberg, the Masters runner-up who is starting to get anointed the biggest challenger to Scheffler.

Scheffler, whose Masters win was his third title in his last four starts, didn’t look as though he did anything special, the very trait that makes him so good. He was bogey-free, picked up birdies on the par 5s on the front nine and then ran off three birdies in a four-hole stretch on the back for a 65.

He was three shots back.

“Didn’t really struggle for par too often today,” Scheffler said. “I felt like I was attacking the golf course pretty well. Was able to post a good number. I felt like today when I stepped on the first tee I was ready to go.”

Morikawa has been searching for the key to that repeatable swing of his that led to a PGA Championship title in 2020 at Harding Park and the British Open a year later. He won last fall in Japan, but has been lacking the trust in whatever fix he keeps making.



But he found something at Augusta National last week — he was among those tied for the lead on Sunday until a pair of double bogeys around the turn — and kept hitting the sweet spot during practice and the opening two rounds of the RBC Heritage.

It’s not perfect, and that certainly was the case Friday. But he feels he is finally on the right path. Morikawa doesn’t feel as though he struck the ball well — he missed 10 greens — and still managed a 66.

“Still have a lot of trust in the swing,” he said. “Whether it went right or wrong, I was able to kind of accept the fact and move on. Two or three months ago — or even two weeks ago — if I saw a couple of bad shots it was like, ‘What do I fix? What do I try?’

“I kind of roughly know where the ball is going, and even when I’m missing it, still everything is a little bit tighter,” he said. “That’s all you can ask for.”



Straka was rattled at the start when he bloodied the spectator. The tee shot was out of play, and Straka checked on the fan to make sure he was OK. He didn’t miss another tee shot the rest of the way.

“You never really want to catch a driver on the fly, especially to the head,” Straka said. “That was tough.”

Aberg is emotionally drained from a week in contention, just like Scheffler. But at 24, he expects to be able to handle the fatigue. His swing is so pure and simple, it never looks as though he is trying very hard.

The Swede had a great finishing kick with four birdies over the last six holes, and one clever change of equipment. Aberg switched out his 2-iron for a 7-wood just for the par-5 15th hole, with has a 90-foot tree protecting the left side.

Share this article Share

The 2-iron was too flat. The 7-wood gives him some height, and it soared from 258 yards over the treetops to about 30 feet for a two-putt birdie.



Rory McIlroy, who knows about hitting a high ball, was impressed for the two days they spent together at Harbour Town. McIlroy was scrappy with his irons again and still managed to stay in the mix at 7-under 135, four shots back.

He was pushing for Aberg to be on the Ryder Cup team last year without having seen him play in person.

“I had way too many people telling me this guy was going to be one of the best,” McIlroy said of when Aberg turned pro last June. “His attitude is absolutely perfect to play golf. It’s not very often the person lives up to the hype. But he lived up to the hype.”

The target is still Scheffler, No. 1 in the world and not looking as though that will change any time soon. He was three off the lead and still looked to be the player to beat.", collin morikawa had another solid round friday in the rbc heritage with a under and appears to be getting back to the reliable form that made him a two time major champion masters champion scottie scheffler s form never seems to change even after an emotionally taxing victory at augusta national a quick trip home to dallas and only nine holes of practice the world s no player is right in the mix it s crowded at the top after two days of warm ideal conditions for scoring at harbour town and this million signature event is wide open going into the weekend morikawa had a four way share of the lead with tom hoge j t poston and sepp straka who recovered from an opening drive that plunked a spectator in the head and led to a double bogey straka saw blood but settled down after hearing the spectator was going to be fine then put together eight birdies for a they were at under one shot ahead of a group that features ludvig aberg the masters runner up who is starting to get anointed the biggest challenger to scheffler scheffler whose masters win was his third title in his last four starts didn t look as though he did anything special the very trait that makes him so good he was bogey free picked up birdies on the par s on the front nine and then ran off three birdies in a four hole stretch on the back for a he was three shots back didn t really struggle for par too often today scheffler said i felt like i was attacking the golf course pretty well was able to post a good number i felt like today when i stepped on the first tee i was ready to go morikawa has been searching for the key to that repeatable swing of his that led to a pga championship title in at harding park and the british open a year later he won last fall in japan but has been lacking the trust in whatever fix he keeps making but he found something at augusta national last week he was among those tied for the lead on sunday until a pair of double bogeys around the turn and kept hitting the sweet spot during practice and the opening two rounds of the rbc heritage it s not perfect and that certainly was the case friday but he feels he is finally on the right path morikawa doesn t feel as though he struck the ball well he missed greens and still managed a still have a lot of trust in the swing he said whether it went right or wrong i was able to kind of accept the fact and move on two or three months ago or even two weeks ago if i saw a couple of bad shots it was like what do i fix what do i try i kind of roughly know where the ball is going and even when i m missing it still everything is a little bit tighter he said that s all you can ask for straka was rattled at the start when he bloodied the spectator the tee shot was out of play and straka checked on the fan to make sure he was ok he didn t miss another tee shot the rest of the way you never really want to catch a driver on the fly especially to the head straka said that was tough aberg is emotionally drained from a week in contention just like scheffler but at he expects to be able to handle the fatigue his swing is so pure and simple it never looks as though he is trying very hard the swede had a great finishing kick with four birdies over the last six holes and one clever change of equipment aberg switched out his iron for a wood just for the par th hole with has a foot tree protecting the left side share this article share the iron was too flat the wood gives him some height and it soared from yards over the treetops to about feet for a two putt birdie rory mcilroy who knows about hitting a high ball was impressed for the two days they spent together at harbour town mcilroy was scrappy with his irons again and still managed to stay in the mix at under four shots back he was pushing for aberg to be on the ryder cup team last year without having seen him play in person i had way too many people telling me this guy was going to be one of the best mcilroy said of when aberg turned pro last june his attitude is absolutely perfect to play golf it s not very often the person lives up to the hype but he lived up to the hype the target is still scheffler no in the world and not looking as though that will change any time soon he was three off the lead and still looked to be the player to beat ,The Washington Post,Sports
86," — Scottie Scheffler is running on fumes after an exhausting Masters victory just four days ago. He hit a shank from a bunker. He nearly lost his mind from mud on his golf ball. And he still managed a 2-under 69 at the RBC Heritage on Thursday.

J.T. Poston set the pace on an idyllic day on Hilton Head Island with nine birdies — six of them in a seven-hole stretch — for a 63 that gave him a two-shot lead over Collin Morikawa and Seamus Power.

Ludvig Aberg, the runner-up at Augusta, was in the group another shot behind. Rory McIlroy birdied his last two holes to salvage a scrappy day with the irons for a 67.

Thousands of fans lined the fairways of Harbour Town to see Scheffler, the Masters champion who is going for his fourth win in his last five tournaments. There were times Scheffler didn’t look like the No. 1 player in the world, and he figured that would be the case with very little time to prepare.



“That’s why I tried to give myself an extra little bit of grace on the course today, just because yeah, emotionally a little drained. Mentally, definitely a bit drained,” he said.

“I feel like I have more energy now than I did at the beginning of the day, waking up to go play golf,” he said. “I think getting into the tournament, hitting some shots, getting a bit frustrated, getting a bit excited about my finish there, all good emotions to feel. It’s nice to be kind of back into tournament mode.”

All but 16 players in the 69-man field were at the Masters, at least for part of the week. Poston closed with a 70 at Augusta National and arrived at Hilton Head Island with a little excitement away from golf. This is the first time traveling with his month-old daughter, Katherine Scott.

They’re calling her Scottie, a family name from both sides of the family.



“Good time to be called Scottie,” Poston said with a smile.

Poston chipped in from 65 feet on the par-3 fourth hole to begin a remarkable run — three straight birdies from the 10-foot range followed, and then a 15-foot birdie putt on the short par-4 ninth and another birdie from 10 feet to start the back nine.

For Morikawa, it was more validation he’s on the right track. The two-time major winner was among those who had a share of the lead Sunday at the Masters until he took a pair of double bogeys around the turn. He wound up in a tie for third.

“A lot of swing thoughts I’ve kind of been flipping the book through worked for one day or two days and then it’s gone,” Morikawa said. “But look, it lasted all the way through the Masters. It’s lasted through here. What I’m doing, it’s working. I’ve just got to stick to that and understand why it’s working and just go out there and play golf.”



Scheffler and Jordan Spieth were in the group behind Poston getting all the attention — Scheffler as the dominant player in golf, Spieth because his entertainment level is high. The fans probably weren’t expecting a shank, and neither was Scheffler.

It happened on the third hole. He was in a bunker right of the green and hit it off the hosel of the club at a 45-degree angle away from the pin, over the green. He chipped to 6 feet and missed the putt, making double bogey.

“I shank it a decent amount, but never in competition,” Scheffler said. “I tried to give myself a little bit of grace there. It clearly was just a mental lapse and I wasn’t quite into it yet. I had a much better back nine.”

That had its moments, too, all on one hole. The 11th gives him fits off the tee, and he finally drilled one, only to see a clump of mud on his ball. His approached headed left and kept going as Scheffler shouted, “MUD BALL!” And the frustration was evident.



He talked to himself harshly down the fairway, especially seeing the ball carom off a slope into the bunker, leaving him an impossible shot. Scheffler did well to blast out to the fringe, and then he holed the putt for par.

Share this article Share

“I was obviously frustrated with that type of break, and then to get up there and knock the putt in was a nice feeling,” he said. “Used it as some good momentum for the closing stretch.”

He hit wedge to 4 feet for birdie on the 16th, made a 15-foot birdie putt on the par-3 17th and ended the day with another round below par. Scheffler now has 37 consecutive rounds at par or better dating to the Tour Championship last August.

Justin Thomas missed the cut at the Masters in horrific fashion by playing the final four holes in 7 over to miss by one. He had only one glitch Thursday — a double bogey when he chipped into the bunker on the par-3 14th — that spoiled an otherwise decent round of 69.", scottie scheffler is running on fumes after an exhausting masters victory just four days ago he hit a shank from a bunker he nearly lost his mind from mud on his golf ball and he still managed a under at the rbc heritage on thursday j t poston set the pace on an idyllic day on hilton head island with nine birdies six of them in a seven hole stretch for a that gave him a two shot lead over collin morikawa and seamus power ludvig aberg the runner up at augusta was in the group another shot behind rory mcilroy birdied his last two holes to salvage a scrappy day with the irons for a thousands of fans lined the fairways of harbour town to see scheffler the masters champion who is going for his fourth win in his last five tournaments there were times scheffler didn t look like the no player in the world and he figured that would be the case with very little time to prepare that s why i tried to give myself an extra little bit of grace on the course today just because yeah emotionally a little drained mentally definitely a bit drained he said i feel like i have more energy now than i did at the beginning of the day waking up to go play golf he said i think getting into the tournament hitting some shots getting a bit frustrated getting a bit excited about my finish there all good emotions to feel it s nice to be kind of back into tournament mode all but players in the man field were at the masters at least for part of the week poston closed with a at augusta national and arrived at hilton head island with a little excitement away from golf this is the first time traveling with his month old daughter katherine scott they re calling her scottie a family name from both sides of the family good time to be called scottie poston said with a smile poston chipped in from feet on the par fourth hole to begin a remarkable run three straight birdies from the foot range followed and then a foot birdie putt on the short par ninth and another birdie from feet to start the back nine for morikawa it was more validation he s on the right track the two time major winner was among those who had a share of the lead sunday at the masters until he took a pair of double bogeys around the turn he wound up in a tie for third a lot of swing thoughts i ve kind of been flipping the book through worked for one day or two days and then it s gone morikawa said but look it lasted all the way through the masters it s lasted through here what i m doing it s working i ve just got to stick to that and understand why it s working and just go out there and play golf scheffler and jordan spieth were in the group behind poston getting all the attention scheffler as the dominant player in golf spieth because his entertainment level is high the fans probably weren t expecting a shank and neither was scheffler it happened on the third hole he was in a bunker right of the green and hit it off the hosel of the club at a degree angle away from the pin over the green he chipped to feet and missed the putt making double bogey i shank it a decent amount but never in competition scheffler said i tried to give myself a little bit of grace there it clearly was just a mental lapse and i wasn t quite into it yet i had a much better back nine that had its moments too all on one hole the th gives him fits off the tee and he finally drilled one only to see a clump of mud on his ball his approached headed left and kept going as scheffler shouted mud ball and the frustration was evident he talked to himself harshly down the fairway especially seeing the ball carom off a slope into the bunker leaving him an impossible shot scheffler did well to blast out to the fringe and then he holed the putt for par share this article share i was obviously frustrated with that type of break and then to get up there and knock the putt in was a nice feeling he said used it as some good momentum for the closing stretch he hit wedge to feet for birdie on the th made a foot birdie putt on the par th and ended the day with another round below par scheffler now has consecutive rounds at par or better dating to the tour championship last august justin thomas missed the cut at the masters in horrific fashion by playing the final four holes in over to miss by one he had only one glitch thursday a double bogey when he chipped into the bunker on the par th that spoiled an otherwise decent round of ,The Washington Post,Sports
